ASSISTANCE_ELIGIBILITY_ID;ASSISTANCE_ELIGIBILITY_NAME
1;Estudantes regularmente matriculados nos cursos em nível de Graduação, da Educação Profissional Técnica de Nível Médio e Pós-Graduação Stricto Sensu da UTFPR e cursando no mínimo uma disciplina
2;Possuir renda familiar per capita de até 1,5 (um vírgula cinco) salário mínimo nacional, vigente no ano de 2023
3;Não acumular bolsas com soma mensal que supere 1,5 salário mínimo nacional, incluindo a soma dos valores das Modalidades de Auxílio Estudantil
4;Não ter reprovação e/ou cancelamento em mais de 33% (trinta e três por cento) das disciplinas cursadas no período letivo de 2022/2
5; Ter realizado a inscrição de acordo com os termos previstos no Edital. 